<?xml version="1.0" encoding="utf-8"?>
<TELC:DataTypes xmlns="http://schemas.intel.com/telemetry/base/1/"
	xmlns:xsi="http://www.w3.org/2001/XMLSchema-instance"
	xmlns:TELC="http://schemas.intel.com/telemetry/base/common"
	xsi:schemaLocation="http://schemas.intel.com/telemetry/base/common telemetry_common.xsd">

	<TELC:dataType name="txtal_time" datatypeID="txtal_time">
		<TELC:dataclass>counter</TELC:dataclass>
			<TELC:units name="seconds">
				<TELC:symbol>s</TELC:symbol>
			</TELC:units>
		<TELC:format>ANY</TELC:format>
	</TELC:dataType>
	<TELC:dataType name="tcore_residency_time" datatypeID="tcore_residency_time">
		<TELC:dataclass>counter</TELC:dataclass>
			<TELC:units name="seconds">
				<TELC:symbol>s</TELC:symbol>
			</TELC:units>
		<TELC:format>ANY</TELC:format>
	</TELC:dataType>
	<TELC:dataType name="tpem_counter" datatypeID="tpem_counter">
		<TELC:dataclass>counter</TELC:dataclass>
	</TELC:dataType>
	<TELC:dataType name="tmem_bw_counter" datatypeID="tmem_bw_counter">
		<TELC:dataclass>counter</TELC:dataclass>
	</TELC:dataType>
	<TELC:dataType name="tenergy" datatypeID="tenergy">
		<TELC:dataclass>status</TELC:dataclass>
	</TELC:dataType>
	<TELC:dataType name="tgeneric_sample" datatypeID="tgeneric_sample">
		<TELC:dataclass>status</TELC:dataclass>
	</TELC:dataType>
	<TELC:dataType name="tstring" datatypeID="tstring">
		<TELC:dataclass>string</TELC:dataclass>
	</TELC:dataType>
</TELC:DataTypes>
