<?xml version="1.0" encoding="utf-8"?>
<TELC:DataTypes xmlns="http://schemas.intel.com/telemetry/base/1/"
	xmlns:xsi="http://www.w3.org/2001/XMLSchema-instance"
	xmlns:TELC="http://schemas.intel.com/telemetry/base/common"
	xsi:schemaLocation="http://schemas.intel.com/telemetry/base/common telemetry_common.xsd">

	<TELC:dataType name="trmid_usage_counter" datatypeID="trmid_usage_counter">
		<TELC:dataclass>counter</TELC:dataclass>
	</TELC:dataType>
	<TELC:dataType name="ttsc_timer" datatypeID="ttsc_timer">
		<TELC:dataclass>counter</TELC:dataclass>
	</TELC:dataType>
	<TELC:dataType name="tenabled_state" datatypeID="tenabled_state">
		<TELC:dataclass>status</TELC:dataclass>
		<TELC:enum>
			<TELC:enum_item>
				<TELC:name>ENABLED</TELC:name>
				<TELC:encoding>1</TELC:encoding>
				<TELC:value>ENABLED</TELC:value>
				<TELC:dataType>string</TELC:dataType>
				<TELC:description>Enabled</TELC:description>
			</TELC:enum_item>
			<TELC:enum_item>
				<TELC:name>DISABLED</TELC:name>
				<TELC:encoding>0</TELC:encoding>
				<TELC:value>DISABLED</TELC:value>
				<TELC:dataType>string</TELC:dataType>
				<TELC:description>Disabled</TELC:description>
			</TELC:enum_item>
		</TELC:enum>
	</TELC:dataType>
	<TELC:dataType name="tstring" datatypeID="tstring">
		<TELC:dataclass>string</TELC:dataclass>
	</TELC:dataType>
</TELC:DataTypes>