<?xml version="1.0" encoding="utf-8"?>
<TELC:DataTypes xmlns="http://schemas.intel.com/telemetry/base/1/"
	xmlns:xsi="http://www.w3.org/2001/XMLSchema-instance"
	xmlns:TELC="http://schemas.intel.com/telemetry/base/common"
	xsi:schemaLocation="http://schemas.intel.com/telemetry/base/common telemetry_common.xsd">

	<TELC:dataType name="treserved" datatypeID="treserved">
		<TELC:dataclass>counter</TELC:dataclass>
	</TELC:dataType>
	<TELC:dataType name="tcpuid_family" datatypeID="tcpuid_family">
		<TELC:dataclass>status</TELC:dataclass>
	</TELC:dataType>
	<TELC:dataType name="tcpuid_model" datatypeID="tcpuid_model">
		<TELC:dataclass>status</TELC:dataclass>
	</TELC:dataType>
	<TELC:dataType name="tcpuid_stepping" datatypeID="tcpuid_stepping">
		<TELC:dataclass>status</TELC:dataclass>
	</TELC:dataType>
	<TELC:dataType name="tcpuid_type" datatypeID="tcpuid_type">
		<TELC:dataclass>status</TELC:dataclass>
	</TELC:dataType>
	<TELC:dataType name="tdomain_id" datatypeID="tdomain_id">
		<TELC:dataclass>status</TELC:dataclass>
	</TELC:dataType>
	<TELC:dataType name="tenabled_state" datatypeID="tenabled_state">
		<TELC:dataclass>status</TELC:dataclass>
		<TELC:enum>
			<TELC:enum_item>
				<TELC:name>ENABLED</TELC:name>
				<TELC:encoding>1</TELC:encoding>
				<TELC:value>ENABLED</TELC:value>
				<TELC:dataType>string</TELC:dataType>
				<TELC:description>Enabled</TELC:description>
			</TELC:enum_item>
			<TELC:enum_item>
				<TELC:name>DISABLED</TELC:name>
				<TELC:encoding>0</TELC:encoding>
				<TELC:value>DISABLED</TELC:value>
				<TELC:dataType>string</TELC:dataType>
				<TELC:description>Disabled</TELC:description>
			</TELC:enum_item>
		</TELC:enum>
	</TELC:dataType>
	<TELC:dataType name="tmctp_eid" datatypeID="tmctp_eid">
		<TELC:dataclass>status</TELC:dataclass>
	</TELC:dataType>
	<TELC:dataType name="tminor_stepping" datatypeID="tminor_stepping">
		<TELC:dataclass>status</TELC:dataclass>
	</TELC:dataType>
	<TELC:dataType name="tplatform_id" datatypeID="tplatform_id">
		<TELC:dataclass>status</TELC:dataclass>
		<TELC:enum>
			<TELC:enum_item>
				<TELC:name>1S_2S</TELC:name>
				<TELC:encoding>0</TELC:encoding>
				<TELC:value>1S_2S</TELC:value>
				<TELC:dataType>string</TELC:dataType>
				<TELC:description>1S/2S (shelf 1, 2)</TELC:description>
			</TELC:enum_item>
			<TELC:enum_item>
				<TELC:name>WS</TELC:name>
				<TELC:encoding>1</TELC:encoding>
				<TELC:value>WS</TELC:value>
				<TELC:dataType>string</TELC:dataType>
				<TELC:description>WS</TELC:description>
			</TELC:enum_item>
			<TELC:enum_item>
				<TELC:name>HEDT</TELC:name>
				<TELC:encoding>2</TELC:encoding>
				<TELC:value>HEDT</TELC:value>
				<TELC:dataType>string</TELC:dataType>
				<TELC:description>HEDT</TELC:description>
			</TELC:enum_item>
			<TELC:enum_item>
				<TELC:name>DE</TELC:name>
				<TELC:encoding>4</TELC:encoding>
				<TELC:value>DE</TELC:value>
				<TELC:dataType>string</TELC:dataType>
				<TELC:description>DE</TELC:description>
			</TELC:enum_item>
			<TELC:enum_item>
				<TELC:name>4S_8S</TELC:name>
				<TELC:encoding>7</TELC:encoding>
				<TELC:value>4S_8S</TELC:value>
				<TELC:dataType>string</TELC:dataType>
				<TELC:description>4S/8S (shelf 3, 4)</TELC:description>
			</TELC:enum_item>
		</TELC:enum>
	</TELC:dataType>
	<TELC:dataType name="tsocket_id" datatypeID="tsocket_id">
		<TELC:dataclass>status</TELC:dataclass>
	</TELC:dataType>
	<TELC:dataType name="tstring" datatypeID="tstring">
		<TELC:dataclass>string</TELC:dataclass>
	</TELC:dataType>
</TELC:DataTypes>